OverallStatus,StartDate,MaximumAge,MinimumAge,EnrollmentType,EnrollmentCount,DetailedDescription,BriefSummary
Completed,"February 19, 2007",,18 Years,,550,"How to effectively educate the public about inherited risk is an important communication issue now and will likely become even more important over the next decade. Little research has been conducted, however, to examine how to communicate about this topic with individuals from underserved populations. The planned study provides a unique and innovative opportunity to examine how to reach an underserved community and present information about inherited risk in an understandable and usable form by building upon an existing relationship between NHGRI and the National Council of La Raza (NCLR). NCLR has previously designed a culturally tailored lay health advisor (LHA) intervention designed to increase knowledge and awareness about inherited risk among Latinos and to motivate them to seek information about their family history. The primary objective of this study will be to examine the pathways by which the LHA communication intervention impacts information seeking outcome variables. We will examine the roles of possible mediating variables (i.e., perceived information need, conceptual knowledge, self-efficacy) and assess the effects of contextual variables (i.e., family and personal history of disease, genetic beliefs, acculturation, health care access, sociodemographic variables) on the outcomes. The second objective is to provide quantitative data on the effects of the intervention on information seeking outcome measures (i.e., discussing family history with family members and health care providers) by comparing the intervention to a brochure-only condition; these data can inform the planning of a large-scale randomized controlled intervention trial. A third objective is to examine predictors of intention to seek information about family history at baseline. A quasi-experimental design will be used; we will recruit 350 individuals to participate in the LHA intervention and 200 to a brochure-only comparison group. All participants will be Spanish-speaking healthy volunteers who are at least 18 years of age and have basic Spanish reading and writing skills. Participants will be recruited through community-based clinics in Oakland, CA and Washington, DC and will either participate in a LHA or be asked to read information about family history. They will complete brief, self-administered questionnaires in Spanish before and after participating in the intervention or reading the brochure. Because of the quasi-experimental design, multiple logistic regression models will be used in the analysis in order to control for covariates. Understanding how to effectively inform underserved communities about inherited risk is a research area of critical importance if genomics is to be used to benefit the public health.","This study will examine how to communicate with an underserved population about inherited disease risks. It will present information about inherited risk to a Latino population through either a lay health advisor (LHA) or through printed information. The LHA is a member of the Latino community who has received training in public speaking, group facilitation, and managing group dynamics and in family health history and genetics. Previous studies have shown that an LHA can effectively communicate health information to diverse audiences, but such interventions have not been studied in the context of inherited risk.

Spanish-speaking Latino men and women over the age of 18 in the Oakland, CA, and Washington, DC, areas who have basic Spanish reading and writing skills may be eligible for this study.

Participants are recruited to one of two groups. One group participates in group educational sessions with an LHA about inherited disease risks and family health history, and the other receives this information from a brochure.

Educational Sessions

Groups of 5 to 8 individuals complete a questionnaire and then participate in a 45-minute educational session on concepts related to genetics, family health history, lifestyle and environment. Participants engage in role-playing to practice discussing family health history with family members. The LHA teaches participants the skills needed to fill in family health history tool called My Family Health Portrait and answers questions. After the question and answer session, participants complete a second questionnaire.

Brochure-Only

Participants complete a questionnaire and then read a Spanish-language brochure produced by the U.S. Surgeon General's Office about the importance of knowing one's family history. They then complete a second questionnaire."
Completed,"December 1, 2014",50 Years,20 Years,Actual,500,"Research background Preimplantational genetic screen (PGS) is tool for diagnosis of embryo chromosome abnormality before transfer. Under this tool, patients with a family history of genetic disease or special genetic disease could avoid to produce chromosomal abnormalities of the next pregnant. For the preemergence of embryos before the genetic diagnosis must be carried out artificial reproductive treatment, the process includes induction of ovulation, ovulation, in vitro fertilization and embryo culture, to embryos grow to six to eight cells or cultured into the stage of blastocyst stage, Under the embryonic section, take one or several cells, the slices of cells for genetic diagnosis, select the embryo without genetic disease implanted in the uterine cavity, in order to avoid the birth of genetic disease offspring.

PGS can reduce the pregnancy when the chromosomal abnormalities of the fetus after implantation, but also to reduce the risk of abortion from chromosomal abnormalities, and can avoid the couples implanted with genetic abnormalities of the embryos, thereby significantly reducing it is important to promote the process of eugenics and reduce the social cost.

Research purposes The detection of chromosomal abnormalities of embryos are important factors for clinical diagnosis or screening before implantation. However, there is no complete analysis of domestic studies. This program will compare the genes or chromosomal abnormalities and clinical outcomes of embryo testing at different stages of embryonic development.

Research design This study is a retrospective study, data collection from 2001 Jan. to 2015. Nov. Patients underwent PGS and data including the couples age, infertility factors, stimulation protocols, medicine records, embryo quality records and blood tests were collected in this study. Analysis the relationship between outcomes of PGS, clinical outcomes and embryo quality is performed and further to find a diagnosis reference for clinical care.","Preimplantational genetic screen (PGS) is tool for diagnosis of embryo chromosome abnormality before transfer. Under this tool, patients with a family history of genetic disease or special genetic disease could avoid to produce chromosomal abnormalities of the next pregnant. This study is a retrospective study, data collection from 2001 Jan. to 2015. Nov. Patients underwent PGS and data including the couples age, infertility factors, stimulation protocols, medicine records, embryo quality records and blood tests were collected in this study. Analysis the relationship between outcomes of PGS, clinical outcomes and embryo quality is performed and further to find a diagnosis reference for clinical care."
"Active, not recruiting",February 2013,,18 Years,Anticipated,49,"If you agree to take part in this study, you will be assigned to 1 of 3 groups based on when you joined the study.

Group 1:

If you are assigned to Group 1, you will take part in a focus group where you will be asked what you would want in a web-based program designed to improve the communication of health and health history information among family members affected by Lynch syndrome. You will also fill out a questionnaire with questions about your demographics (age, race, marital status) and your medical history. This visit should take about 1 hour to complete.

Group 2:

If you are assigned to Group 2, you will come to the Behavioral Research and Treatment Center (BRTC) at MD Anderson to use the initial version of the My Family Garden website. My Family Garden is designed to teach new ways of communicating about Lynch Syndrome and about other issues related to the disease (such as risks associated with the disease, etc.). You will be instructed on how to use the program by the study staff. After you use the website, you will have an interview where you will provide feedback on your session. You will be asked questions about your feelings about the website and about any possible improvements that could be made to the website. You will also fill out a questionnaire called the Website Analysis and MeasureMent Inventory (WAMMI) which is designed help rate websites. You will also fill out the demographics questionnaire described above.

You will be given the option of completing the WAMMI and demographics questionnaire at the BRTC after your session or at your home. If you choose to complete them at home, you will be provided with a self-addressed, postage-paid envelope so you can mail the questionnaires back to the study staff.

This visit should take about 90 minutes to complete.

Group 3:

If you are assigned to Group 3, you will use the final version of the My Family Garden website. This final version will include changes from the web designers after feedback has been given from the previous groups in this study.

After you use the website, you will have an interview where you will provide feedback on your session. You will be asked questions about your feelings about the website and about any possible improvements that could be made to the website. You will also fill out the WAMMI questionnaire and demographics questionnaire described above.

You will be given the option of coming to the BRTC at MD Anderson to use the My Family Garden computer program or using the program from your home. If you choose to use My Family Garden from your home, you will be given a secure, password-protected hyperlink via e-mail to access the program. You will be instructed on how to use the program by the study staff either in person or over the phone. If you use the program from your home, the study staff will give the interview over the phone. If you complete the questionnaire at your home, you will be provided with a self-addressed, postage-paid envelope so you can mail it back to the study staff.

Whether it is completed at MD Anderson or at home, this visit should last about 90 minutes.

Audiotapes:

All focus groups and interviews will be audiotaped. The audiotapes collected during the course of this study will be stored in locked file cabinets in a locked office and will be destroyed after 5 years.

Length of Study Participation:

Your participation in this study will be over after you have completed the study procedures described above.

This is an investigational study.

Up to 49 participants will be enrolled in this study. All participants will be enrolled at MD Anderson.",The goal of this research study is to create an internet-based program designed to improve the communication of health and health history information among family members affected by Lynch syndrome.
Recruiting,"July 17, 2015",100 Years,1 Year,Anticipated,16000,"Without an explanation for severe and sometimes life-threatening symptoms, patients and their families are left in a state of unknown. Many individuals find themselves being passed from physician to physician, undergoing countless and often repetitive tests in the hopes of finding answers and insight about what the future may hold. This long and arduous journey to find a diagnosis does not end for many patients- the Office of Rare Diseases Research (ORDR) notes that 6% of individuals seeking their assistance have an undiagnosed disorder. In 2008, the National Institutes of Health (NIH) Undiagnosed Diseases Program (UDP) was established with the goal of providing care and answers for these individuals with mysterious conditions who have long eluded diagnosis. The NIH UDP is a joint venture of the NIH ORDR, the National Human Genome Research Institute Intramural Research Program (NHGRI-IRP), and the NIH Clinical Research Center (CRC). The goals of the NIH UDP are to: (1) provide answers for patients with undiagnosed diseases; (2) generate new knowledge about disease mechanisms; (3) assess the application of new approaches to phenotyping and the use of genomic technologies; and (4) identify potential therapeutic targets, if possible. To date, the UDP has evaluated 3300 medical records and admitted 750 individuals with rare and undiagnosed conditions to the NIH Clinical Center. The NIH UDP has identified more than

70 rare disease diagnoses and several new conditions. The success of the NIH UDP prompted the NIH Common Fund to support the establishment of a network of medical research centers, the Undiagnosed Diseases Network (UDN), for fiscal years 2013-2022. The clinical sites will perform extensive phenotyping, genetic analyses, and functional studies of potential disease-causing variants. The testing performed on patients involves medically indicated studies intended to help reach a diagnosis, as well as research investigations that include a skin biopsy, blood draws, and DNA analysis. In addition, the UDN will further the goals of the UDP by permitting the sharing of personally identifiable phenotypic and genotypic information within the network. By sharing participant information and encouraging collaboration, the UDN hopes to improve the understanding of rare conditions and advance the diagnostic process and care for individuals with undiagnosed diseases.","Background:

- Without an explanation for severe and sometimes life-threatening symptoms, patients and their families are left in a state of unknown. The NIH helped create a network of medical research centers, called the Undiagnosed Diseases Network (UDN), to provide care and answers for these individuals.

Objectives:

- To improve diagnosis and care for people with undiagnosed diseases.

Eligibility:

- People with undiagnosed diseases, and their relatives.

Design:

Participants will travel to one of the UDN medical centers for a 5-day clinical and research visit.

As part of the visit, UDN healthcare providers may ask participants to have:

Clinically indicated tests and procedures performed including:

A physical exam
Blood and urine tests
A review of health and family history
X-rays and body scans
Surveys
Photographs of the face and body
A special diet to see if the body can handle the food without having a reaction, like vomiting
Video or voice recordings
Other tests and procedures to help reach a diagnosis

Research tests and procedures performed including:

A skin biopsy. For this, a small piece of skin will be taken.
Surveys
Other tests and procedures for research that may not be related to a diagnosis or treatment.
Most participants will be asked to give samples for genetic testing.
Participants may be contacted after their visit to discuss test results. They may also be contacted in the future for interviews and surveys.
Relatives of participants may be asked to give samples for genetic testing. They may be asked to have parts of their visit recorded and to have additional tests. They may also be contacted in the future for interviews and surveys.
Clinical and research information collected will be stored in a database.
Information and samples collected will be shared with others for research purposes."
Recruiting,"November 23, 1976",,8 Months,Anticipated,4000,"We propose to characterize the etiology and natural history of rare inborn errors of metabolism and other genetic disorders, both known and yet-to-be discovered. In so doing, we will expand our knowledge about these disorders and provide access to patients of interest for research, teaching, and clinical experience. Individual patients seen under this protocol have prompted the establishment of specific disease-related protocols involving intensive natural history studies and innovative therapies. In addition to its longstanding role in investigating individuals who are of interest to the Section on Human Biochemical Genetics, this protocol provides one possible avenue (in addition to other NIH protocols) for admitting patients who are part of the NIH Undiagnosed Diseases Program.","Researchers intend on diagnosing and treating certain inborn errors of metabolism. By doing this researchers hope to expand their knowledge about these disorders and provide access to patients of interest for research, teaching, and clinical experience.

Patients participating in this study will be examined and treated on an out patient basis, if practical. However, patients requiring specialized tests or treatments will be admitted to the NIH Clinical Center as necessary. Researchers will use only accepted medical procedures in diagnosing (medical history, physical examinations, X-ray studies, eye examinations, blood tests, and urine tests) and treating the patients involved in this study. Additional tests may be required on a case to case basis.

Many patients seen in this study will go on to be enrolled in a specific disease-related research study.<TAB>"
Completed,"September 18, 1997",,18 Years,Actual,157,"The Amish and Mennonite populations represent outstanding communities for the study of genetic disease for a number of reasons. There is a high degree of inbreeding, resulting in a high frequency of recessive disorders, many of which are seen rarely or are unknown outside of this population. Extensive genealogical records are available, and the average family size is large. This proposal includes a number of collaborators who have had extremely close, extensive interaction with the Lancaster County Amish over the past decade; their relationships with the community are invaluable to the success of this project. We have had substantial success with this research over the past seven years, leading to the discovery of the molecular etiology of four human diseases and the establishment of a useful database and tools for genealogical analysis. We propose to continue this line of research to further characterize these disorders and identify additional ones, as well as enlarging a computerized Anabaptist genealogy.","The purposes of this study are to identify the genes responsible for several inherited disorders commonly seen in the Amish and Mennonite populations and learn more about the natural history (medical problems that develop over time) of these disorders. In addition, researchers will establish a computer database containing Amish genealogies, derived largely from the community s extensive records of births, marriages, deaths, etc., that will help construct pedigrees (family trees) for genetic study.

The Amish and Mennonite peoples have a high rate of intermarriage within their individual communities, with a resulting high incidence of inherited disorders. Many of these disorders, such as cartilage-hair hypoplasia, Ellis-van Creveld syndrome, and others, are rarely seen outside these communities. New research using state-of-the-art methodologies in genetics will add to current knowledge about the causes and symptoms of these disorders that will eventually aid in their diagnosis and medical management.

Patients with inherited disorders that occur frequently in the Amish and Mennonite populations and their family members may be eligible for this study. Individuals from both within and outside these communities may enroll.

Participants will be evaluated with a review of their medical records and their personal and family medical history and a brief physical examination. A small tissue sample will be collected for genetic studies. This will be either a blood sample (3 teaspoons from adults and 1 to 3 teaspoons from children, depending on their size) or a mouth swab (cells removed from inside the cheek by gentle brushing). Some participants may undergo additional procedures, such as diagnostic X-rays, brain scans, echocardiogram (heart ultrasound) or other studies.

If genetic testing shows a gene change (mutation), the participant will be notified to that effect in writing and offered counseling in their home regarding the test results and their implications."
Recruiting,"May 22, 2014",,18 Years,Anticipated,300,"Leg ulcers are a serious and debilitating complication of sickle cell disease (SCD). This study will explore microbial, genomic, and environmental (social and physical) factors, that may influence the onset and progression of leg ulcer formation and delayed healing in individuals living with SCD. There is variation in the incidence and duration of SCD leg ulcers. They are often very painful, resistant to treatment, and recurrent in nature. The etiology of SCD-associated leg ulcers is unclear, and we hypothesize that predisposition to developing leg ulcers is multifactorial. This multi site study is an exploratory study of the microbiome and environment of individuals living with sickle cell disease leg ulcers. The study s objective is to identify triggers that may be integral in leg ulcer onset and progression. The central goal of this study is to obtain an improved understanding of the participants clinical phenotype, leg ulcer mircobiome and the psychosocial and environmental factors that may impact this complication.

To achieve these goals, we will: (1)characterize the leg skin microbiome of SCD participants living with and without leg ulcers within the United States; (2) collect and analyze psychosocial and physical environmental data of individuals with SCD without leg ulcers and with leg ulcers; (3) examine the psychosocial impact of leg ulcers on individuals with SCD by conducting a qualitative phase to explore the individual experiences to understand the physical function, stigma, and self-esteem associated with those with active, recurrent, or single-occurrence presentations of leg ulcers; and (4) explore what factors influence psychological resilience, to examine the relationship of psychological resilience to the health outcomes of an adult population living with sickle cell disease in the U.S. This will afford participants the chance to expound upon existing questions and will provide us the opportunity to understand the complexity of participants experiences and quality of life","Background:

- People with sickle cell disease and other blood disorders sometimes get chronic leg ulcers. These are wounds that develop on the skin and don t go away. Current treatments do not work very well, so researchers want to learn more about why the ulcers happen. They want to find out which bacteria may cause it, and if external factors play a role.

Objective:

- To study social and environmental factors of sickle cell disease and the causes of sickle cell disease leg ulcers.

Eligibility:

- People age 18 and older who have sickle cell disease or another red cell disorder, with or without an active leg ulcer.

Design:

Participants will have a medical history and clinical evaluation. They will also have blood drawn.
Participants will complete questionnaires about their life, health, environment, stress, and other topics.
Participants may provide a small sample of hair.
Participants will be asked to collect a small amount of saliva.
Participants with leg ulcers will have their skin microbiome sampled. The microbiome is all of the microbes (bacteria and and/or fungi) and their genes in and on the body. Researchers will use swabs to collect skin samples. Photographs will be taken of the skin sample area.
Some participants without leg ulcers also will have their skin microbiome sampled.
Some participants who have their skin microbiome sampled will return for a second visit. At this visit, their microbiome will be resampled. It will take place more than 30 days after the first visit."
Completed,September 2008,,,Actual,22,,This trial is conducted in Europe. The aim of this trial is to obtain the PTPN11 mutation status and investigate the impact of the PTPN11 mutation status on the effect of somatropin (Norditropin®) by use of data obtained in the GHNOO-1658 trial.
