OverallStatus,StartDate,MaximumAge,MinimumAge,EnrollmentType,EnrollmentCount,DetailedDescription,BriefSummary
Recruiting,"May 3, 2016",,,Anticipated,5000,"The aim of this protocol is to allow genetic-related evaluations for patients with a variety of known or suspected genetic disorders, supplement and offer an additional opportunity for training in clinical genetics, dysmorphology and metabolic genetics in the National Institute of Child Health and Human Development (NICHD) and other Institutes of the National Institutes of Health (NIH). If not eligible for a specific NICHD research protocol, patients with genetic-related conditions may be evaluated under the auspices of this protocol to advance the clinical skills of physicians participating in NICHD clinical research and training programs, and to provide stimuli for new clinical research initiatives. Standard medically-indicated laboratory or radiological studies may be performed to confirm a diagnosis or to aid in the management of the patient. In some cases, the subjects may receive medical or surgical treatment for their disorder at the NIH CC according to current clinical practice. The overall purpose of genetic evaluations under this protocol is to support our clinical training and research missions. Family members of subjects evaluated on this protocol (who have informative meiotic inheritance relationships to the proband or index case) may also be enrolled.","Background: Some patients with unusual genetic conditions are referred to the National Institutes of Health (NIH). They may not be eligible to join current research studies. Testing such patients is a good way to improve the skills of research staff. The findings could lead to new processes and research.

Objectives:

To recruit a diverse group of pediatric subjects with genetic disorders. To give clinic staff hands-on experience working with these patients.

Eligibility:

Children any age with a known or suspected genetic disorder.

Design:

Participants will be screened with medical history and physical exam. They may have lab and other tests.

Family members may give DNA samples.

Participants will have:

Medical history

Physical exam

Height, weight, and other measurements taken.

A clinical evaluation of their disorder.

They may have:

Blood, urine, and saliva samples taken

Imaging tests. These may include x-rays, scans, ultrasound, or skeletal survey.

A sleep study

A visit with other specialists at NIH

A genetic test from a commercial lab

Medical photographs taken

Other tests

Participants may have follow-up visits. They may get medical or surgical treatment."
Not yet recruiting,"August 1, 2019",3 Years,,Anticipated,150,"The main objective of this study is to apply a well-established model of developmental surveillance (which evolved to characterize the outcomes of very low birth weight infants) to infants with genetic disorders. A novel clinical model for infants with rare genetic disorders has been created as a joint initiative between the Division of Newborn Medicine's NICU Growth and Developmental Support Programs (NICU GraDS) program and the Division of Genetics at Boston Children's Hospital (BCH). This study plans to enroll patients with genetic syndromes seen in this clinic into a prospective, longitudinal study in order to characterize their developmental profiles and needs. Related factors such as quality of life and parental stress will also be assessed which will complement the evaluation of the role of a ""developmental home"" for these high risk infants. It is also hypothesized that gaps in care - mismatches between services received and services indicated based upon the developmental evaluation - will be identified. The results of this study will be used to inform future research efforts utilizing targeted approaches to improve developmental outcomes.

For infants with rare genetic disorders, the aims are as follows:

Aim 1: Characterize physical and psychosocial development using standardized longitudinal assessments.

Aim 2: Identify developmental service needs, prescription, and utilization.

Aim 3: Assess parental stress and health-related quality of life.","The main objective of this study is to apply a well-established model of developmental surveillance (which evolved to characterize the outcomes of very low birth weight infants) to infants with genetic disorders. A novel clinical model for infants with rare genetic disorders has been created as a joint initiative between the Division of Newborn Medicine's NICU Growth and Developmental Support Programs (NICU GraDS) program and the Division of Genetics at Boston Children's Hospital (BCH). This study plans to enroll patients with genetic syndromes seen in this clinic into a prospective, longitudinal study in order to characterize their developmental profiles and needs."
Completed,October 1994,,,,1200,"Individuals and their families affected by disorders with a potentially genetic basis within six broad categories will be evaluated over time to characterize the natural and clinical history of various specific disorders. Medical and laboratory evaluations will be completed to identify areas of management concern that have not been previously described. Further protocols will be developed addressing specific disorders once a number of affected individuals have been investigated and is sufficient to query various aspects of those disorders. Issues for both diagnosis and medical management of those affected with certain genetic disorders will be collated and addressed within a national consensus conference format. In addition, phenotype to genotype correlation will be established to further understanding of specific molecular alterations on phenotypic expression. This broad-based protocol will also facilitate the training of fellows in medical genetics, graduate and post graduate training in genetics and genetic counseling.","This study will investigate the cause and natural history (medical problems that appear over time) of certain genetic disorders. It will also try to locate the abnormal genes responsible for these conditions and eventually develop tests to predict who is likely to be affected and to what degree.

Patients with known or suspected genetic disorders in certain categories, such as those involving chromosomal or metabolic abnormalities, immune system or blood disorders, abnormal growth, benign tumors, and others may be eligible for this study. Participants will be interviewed by specialists in genetics about their condition and family history. They may also be asked to have a physical examination and certain tests needed for study of the specific individual's condition. These may include collection of blood samples (up to 3 tablespoons); imaging studies, such as computerized tomography (CT), magnetic resonance imaging (MRI), ultrasound and echocardiography; skin biopsy (removal of a small sample of skin tissue under local anesthetic), and other procedures. DNA testing may reveal the genetic abnormality responsible for the disorder. Participants who so wish will have an opportunity to talk with experts about the health implications of the test results.

This study may provide information that will lead to improved treatment or management of these inherited disorders, as well as more effective genetic counseling for families."
Completed,"October 25, 2001",18 Years,,Actual,1090,"The aim of this protocol is to provide care for patients with a variety of rare genetic disorders, supplement and offer an additional opportunity for training in clinical genetics, dysmorphology and metabolic genetics in the National Institute of Child Health and Human Development (NICHD) and other Institutes of the National Institutes of Health (NIH), and spearhead the development of new research protocols on particular aspects of diagnosis and care for specific genetic diseases. Evaluations of patients with a broad spectrum of metabolic and genetic conditions will be performed. In addition, genetic counseling services will be offered to patients and their families to assess risk, and give information on preventive measures, and testing options. Disorders that will be studied include chromosomal and Mendelian disorders of childhood and/or adult onset, congenital anomalies and/or birth defects, dysmorphic syndromes, familial cancer syndromes, multifactorial disorders, and metabolic abnormalities. If not eligible for another NICHD research protocol (specific for a disease or a treatment), patients with genetic/metabolic-related conditions may be evaluated under the auspices of this protocol to advance the clinical skills of physicians participating in NICHD clinical research and training programs, and to provide stimuli for new clinical research initiatives. Standard, medically indicated laboratory or radiological studies may be performed to confirm a diagnosis or to aid in the management of the patient. In some cases, the patient will receive medical or surgical treatment for their disorder, according to current clinical practice. Patients and/or family members with genetic disorders may offer their DNA for storage and/or testing. The overall purpose of this protocol is to support our Institute s training and research missions by expanding the spectrum of diseases that can be seen in our clinics and wards.","This study will provide medical evaluations for patients with known or suspected metabolic and genetic disorders. It will allow NICHD investigators and trainees experience in diagnosing, managing, and treating patients with metabolic and genetic disorders who may not be eligible for an active NIH research trial. Participants in this protocol will only have tests and procedures used in the standard practice of medicine; there will be no experimental tests or treatments. Patients who are found eligible for an active research protocol will be offered participation in that study. The medical evaluations in this trial may uncover new disease processes that prompt new research initiatives.

People of all ages with a suspected or diagnosed genetic or metabolic condition may be eligible for this study. In addition, children with unexplained developmental delay, deafness, dysmorphism, congenital malformations, acidosis, failure to thrive, feeding problems, short stature, birth defects, and other syndromes of unknown cause may qualify.

Participants will have a medical history, including a family history, with possible review of previous medical records, and a physical examination. Other procedures may include:

Consultation with medical specialists.
Hearing and/or vision tests.
Imaging studies, such as X-rays, ultrasound and magnetic resonance imaging (MRI).
Blood drawing Blood samples (2 to 4 tablespoons from adults and 1 to 2 tablespoons from children) may be used for routine lab tests, genetic study, and other research purposes.
Cheek swab DNA may be obtained by a cheek swab. A small brush is rubbed against the inside of the cheek to collect some cells.
Skin biopsy Under local anesthetic, a small circle of skin (about 1/8-inch) is removed with a sharp cutting instrument similar to a cookie cutter.
Muscle biopsy Under local anesthetic, a small piece of muscle tissue is removed to aid in diagnosis.

Participants will undergo only diagnostic procedures that are clinically indicated; that is, only tests needed to confirm or rule out a diagnosis will be done. Tissue samples collected for diagnostic purposes may also be used to obtain DNA for genetic studies and to establish cell lines (cells grown in the laboratory to be maintained indefinitely) for future research.

The results of the medical evaluation may indicate whether or not the participant has the disease that runs in the family (if a genetic disorder is indeed confirmed). Unless he or she requests otherwise, the subject (and parent in the case of a minor) will receive counseling regarding the test results. The implications of a positive test result will be explained, specifically, the participant s risk of having the disease, and the risk of passing the condition on to offspring."
Completed,November 2007,2 Weeks,,Actual,1000,"Summary of Relevant Background Studies: Congenital anomalies play a major role in pediatric care. One of the leading causes of infant mortality in developed countries is the sequelae of these congenital anomalies. In some cases this exceeds the death rate for prematurity, SIDS, and other common causes of infant or neonatal death. The available tools for the assessment of a dysmorphic infant or child are based mainly on the experience of the examiner and his ability to translate findings and measurements from the physical examination to a qualitative and quantitative summary of accepted values plotted for the corresponding age (1,2). Various unusual features are expressed in qualitative terms such as short stature, long fingers, pear-shaped nose, small ears or other terms, which imply a comparison with other body proportions and the subjective impression of the examiner. Following that, an impression of the patient as a 'gestalt' is formed in the examiner's mind.

The databases and most of the written material are descriptive with scarce graphic and photographs, making the comparison of the phenotypic expression of the described subject with the one that needs to be diagnosed a difficult one. Even with the extensive existing data on objective measurements available to characterize a phenotype, many of the physicians involved in the diagnosis of a specific case will base part of their diagnosis on ""it looks like"" and put that impression in the context of other physical and laboratory findings.

Many syndromes in human pathology are recognized by their unique and distinctive facial and body characteristics. These stereotypic phenotypic characteristics are mostly reproducible using anthropometric measurements.

Charts are available for nor+mal data values of various morphometric variables (1,2). However, some of these figures can be accurately measured only on 3D structures (head, face). The following figure demonstrates the measurement of the angle of the palpebral fissure:

Fig. 1: An upward obliquity to the palpebral fissures is known as a mongoloid slant while downward obliquity is referred to as an antimongoloid slant. In order to obtain such measurements within the uterus a 3D configuration and appropriate image analysis is necessary (Figure from Ref. 2).

Fetal alcohol syndrome (FAS) is an example of a syndrome that underwent characterization by graphic data analysis methods (3). The prevalence of fetal alcohol syndrome (FAS) was determined in a foster care population and evaluated the performance of the FAS Facial Photographic Screening Tool. The authors concluded that the screening tool performed with very high accuracy and could be used to track FAS prevalence over time in foster care population to accurately assess the effectiveness of primary prevention. An expert can recognize facial characteristics and provide accurate analysis. Objective measurements could provide less experienced observers with tools that classify anatomical characteristics of different diseases and syndromes. Facial phenotypic patterns can be extracted from large databases of facial surfaces. These biometric measurements can be used for analysis when evaluated with respect to their ""normal"" values in the general population.

3- Methods of Study: Following approval of the Helsinki Committee, the project will be performed in several successive steps as follows: A. Newborn scanning: A database of 3D pictures (scans) of the face of newborn infants will be created. The scanning will be performed initially at the Carmel Medical Center, during their hospital stay. The examinees will be scanned one time, in order to build a database based on the data obtained from each scanned picture.

The facial anthropometric patterns of the obtained 3D pictures will be studied off-line using a computerized face pattern recognition system developed and used at the Faculty of Computer Sciences at the Technion. The measurements obtained will be compared to geometric anthropometric data already in use by medical geneticists and clinicians (1-9).

B. Hardware and software description:

3D Image Acquisition: Special hardware specially prepared in our department was developed for 3D image acquisition of newborn (see figure 2).

The hardware consists in:a structured light projector (DLP Projector Casio 350j,a digital video camera (PTGray Flea CCD Camera (Point Grey Research® Inc.( Black and white (640x480), Aluminum projector cage, Special medical stand with wheels,Personal Computer - Pentium 4 - XP,Flat screen 17"" with stand mount,Firewire cables,I/O cables.

Systems used for image acquisition: Currently there are two basic technologies. One is a laser scan, where a narrow laser generated light plane scans a face in vertical direction and the 3-D structure of the face is recovered based on the form of the light contour at the intersection between the light plane and the face surface.

The second method is based on the so-called structured light technology (regular light), where one or more specially designed light patterns are projected onto a face, and the 3D structure is recovered based on the position measurements of known pattern elements projections on the face.

Next, the range image is converted to a triangulated surface. The mesh can be possibly sub-sampled in order to decrease the amount of data. The choice of the number of sub-samples is a tradeoff between accuracy and computational complexity. Using this technique image acquisition and reconstruction takes about 2-3 seconds.

C. Morphometric parameters and their computation: In order to compute common morphometric parameters like inner and outer cantal distance, interpupillary distance, etc., there is a need to recognize various points of interest in the 3D face. This will be done using various pattern recognition algorithms. At the initial stage a manual procedure will be used to mark features on the projection of the facial surface.

Based on the results of the first phase automatic methods will be developed to detect features using statistical and algebraic algorithms. After having the relevant anchor points secured, simple 3D geometry will be used to compute common morphometric data. Parameters include outer canthal distance, interpupillary distance, palpebral fissure length, palpebral fissure angle, nasal-labial (philtrum) length, ear length, ear height, etc. The 3D data available can be used to try and search for other parameters that might be considered as statistically meaningful indicators.

Another avenue of research is to examine the importance of other metrics for distance estimation. One option is to check the contribution of geodesic distances as indicators. Geodesic distance is a distance map computed on the surface itself (Riemannian metric). A minimal geodesic path is the shortest path on the surface connecting two points.

An efficient method for computing the minimal geodesic distances on a triangulated domain was developed by Kimmel and Sethian (10). As the face is a deformable surface it is important to use such a representation for the facial surface that the measurements performed on it would be invariant to possible deformations (i.e. various facial expressions). In this case a bending invariant surface representation introduced by Elad and Kimmel will be used (11).

D. Statistical methods will be used for detecting the best independent significant morphometric variables which significantly correlate with the various syndromes: Discriminating scores will be constructed using the regression coefficients of the multivariate analysis tests and best cutoff points will be found, predicting between different genetic anomalies. Testing of the method and of the results will be done using a validation group of patients and healthy controls, by independent observers. The syndromatic examined newborn infants will be assessed by a geneticist and confirmation of the diagnosis will be made by laboratory tests when appropriate.

E. Statistical Power and number of patients: Many morphometrical variables will be assessed, based on our 3D reconstructing methods. Only after applying the multivariate analysis on the results, the relative diagnostic importance of each variable will be revealed. Thus, no single variable can be considered at this point, as an absolute discriminator between normal and abnormal value. However, if considering for example only one 3D morphometric variable, such as the degree of palpebral fissure slanting, in order to discriminate between ""Trisomy 21"" and ""normal"" in the Caucasian population, the following power analysis can be computed: The average and SD values of the slanting eye angle in ""normal"" is: 3.5 (degrees) ± 1.5. In a Trisomy 21 patient, there is an upward shift of this value. In order to detect a shift of more than 2 SD's (i.e. of more than 3 degree) and supposing that the SD will be larger than 3 degrees in the pathological population we need a minimal number of 21 patients and controls, in order to obtain a statistical power of 90%.

Total number of patients: Our purpose is to obtain scans from 800 newborn infants during the two year study period.","The hypothesis to be tested: After the construction of a database of anthropometric measurements, the system would extract important features of a given facial surface and be able to match it with existing morphometric figures. A given combination of normal and abnormal measurements will open a ""probable diagnosis"" and a list of ""differential diagnosis"" that will be expressed as percent of matching in a descendent order to the examiner."
Completed,"January 31, 2015",18 Years,,Actual,200,"Patients will be recruited from in- and outpatient clinics at the Otto Heubner Center, the Berlin Center for Rare Diseases, and the Institute for Medical Genetics and Human Genetics at Charité-Universitätsmedizin Berlin, Germany. Following informed consent, 5 ml EDTA blood will be obtained from the index case and 10 ml blood from each parent. Disease related phenotype information and the outcome of previous diagnostic tests and procedures will be recorded as part of Study visit #1.

[1] Study visit #1

A medical genetics physical will be performed. Detailed clinical symptoms (phenotype) will be recorded using Human Phenotype Ontology (HPO) terminology.
A detailed pedigree will be drawn.
Age of disease onset will be determined.
Results from previous diagnostic tests and procedures, as well as hospital stays, will be recorded.
The parents will be asked to complete a validated, standardized quality of life questionnaire adapted for for rare disease. The questionnaire is available online or in paper form.

[2] Study visit #2a (optional)

This study visit will only take place in the event that gene panel sequencing identifies a variant of uncertain significance, where additional information would be needed in order to determine its pathogenicity (e.g. confirmational biochemical testing, collection of additional information). Relevant research findings will be discussed and the nature and necessity of the additional testing will be explained.

[3] Study visit #2b (optional)

This study visit will only take place in the event that WGS identifies a variant of uncertain significance where additional information is needed in order to determine its pathogenicity > see Study visit #2a.

[4] Study visit #3 (results session)

Results will be returned in the context of a genetic counseling session.

[5] Study visit #4 (6 months after Study visit #3)

The parents will be asked to complete the validated, standardized quality of life questionnaire adapted for rare disease again.","The MENDEL-study will investigate whether the use of gene panel or whole genome sequencing (WGS) will:

improve the rate of diagnosis and through this compare the performance of the two diagnostic approaches (gene panel vs. WGS),
investigate whether use of said sequencing approaches early in the diagnostic process results in reduced health care spending, and
result in an improved quality of life for the patients and their parents."
